{
  "assignment_count": 2,
  "assignments": [
    {
      "backend": "external-systolic",
      "family": "matmul",
      "operation": "projection",
      "output_layout": "blocked"
    },
    {
      "backend": "external-vector",
      "family": "elementwise",
      "operation": "activation",
      "output_layout": "row_major"
    }
  ],
  "audit_contract": "objective_delta.contract_reimplementation.stdlib.v0",
  "audit_status": "PASS",
  "blocked_claims": [
    "independent_organizational_reproduction",
    "arbitrary_source_intent",
    "external_package_code_execution",
    "native_backend_execution",
    "physical_device_portability",
    "native_performance_parity"
  ],
  "conformance_vector_contains_public_values": true,
  "conformance_vector_digest": "sha256:b03d192c1868c2a1c9b0169e4a3bbe2d609ab823ce0f64cf157b80dccccf3aef",
  "external_code_executed": false,
  "independent_organizational_evidence": false,
  "layout_conversion_count": 1,
  "layout_conversions": [
    {
      "consumer": "activation",
      "from_layout": "blocked",
      "producer": "projection",
      "tensor": "projection",
      "to_layout": "row_major"
    }
  ],
  "native_backend_execution": false,
  "native_performance_claim": false,
  "network_access": false,
  "numpy_imported": false,
  "output_digest": "sha256:db8ad36b4074749f60a69cb958471064c3311d5343744d75b6e298bd48299039",
  "outputs_match": true,
  "package_digests": [
    "sha256:806813974dfde16b46f694566d751b18780d5e43d8455467bf4e5d7ea38b452c",
    "sha256:bf4bf333025a176f20ad927c249747f6ce923e14f224f4cd94ed769d893288ee"
  ],
  "package_ids": [
    "external-systolic-reference-package",
    "external-vector-reference-package"
  ],
  "physical_device_execution": false,
  "proof_scope": "fixed_2x2_matmul_then_identity",
  "public_output_names": [
    "api_activated"
  ],
  "python_code_executed": true,
  "raw_tensor_values_serialized": false,
  "schema_version": "tuc.objective_delta_audit_report.v0",
  "source_intent_digest": "sha256:5c5a6435ff498a159e09b76a99f4103531ab8c1659f28185d3586c5e11c5aace",
  "stdlib_only": true,
  "subprocess_execution": false,
  "third_party_dependencies": false,
  "tuc_imported": false
}
